entity,type,desires,fears
Planning Processes or Projects,Initiatives,"Integrating equity into decision-making, identifying climate change adaptation options, and addressing social vulnerability","Lack of support, inadequate resources, and failure to effectively address climate change impacts on communities"
Packaging Technology,Concept,Effective application of graphic design theories,Ineffective application of graphic design theories leading to futile efforts
Survey Respondents,Group of Participants,"Preventing development in low-lying areas, developing Climate Gap Neighborhood Action Plans, improving levee protection, involving fire and police officers in community planning, implementing low-impact development and green infrastructure, wetland restoration, and training community members in disaster preparedness","Lack of community engagement, inadequate funding, and failure to address equity issues related to sea level rise"
Limited English Proficiency,Population demographic factor,Access to language support services,Communication barriers leading to exclusion and limited access to information
"Local Experts, Organizations, and Agencies",Stakeholders,"Engaging local community members, identifying and funding community-based adaptation, building resilience by protecting vulnerable communities","Lack of coordination with government agencies, insufficient resources for climate change adaptation, failure to address equity issues"
Zero-Vehicle Households,Population demographic factor,Accessible and reliable public transportation options,Limited mobility and difficulty accessing essential services
Single-Parent Households,Population demographic factor,Support for balancing work and family responsibilities,"Financial instability, lack of childcare options, and social stigma"
Coastal planners,Professionals,Access to accurate and up-to-date reports and census data for effective analyses,Lack of necessary information leading to ineffective planning and response to coastal flooding and related impacts
Package designs,Concept,"To effectively inform, educate, and persuade consumers towards purchasing the product they represent, following appropriate graphic design theories; To be appealing and effective in conveying information to consumers; To be perceived as effective and appealing to consumers","Being disregarded or misinterpreted by consumers due to poor design choices or lack of adherence to graphic design principles, resulting in decreased consumption rate or purchase preferences; Not being attractive or failing to fulfill its purpose; To be deemed unappealing or ineffective in conveying the intended message"
Graphic design theories,Concept,To be perceived as essential for developing attractive packaging and designs; To provide a system of ideas that help designers explain their design choices; To be acknowledged as essential for creating attractive graphic/package designs; To be recognized as essential in packaging design and development of upcoming graphic designers; Being applied effectively in packaging technology; To positively influence the creation of effective and attractive package designs; To guide graphic designers in creating visually appealing packaging designs that enhance product marketing; To be positively influential in the creation of effective and attractive package designs; To be recognized as playing an important role in packaging design,"Being overlooked or not considered important in the creation of appealing graphic designs; Being disregarded or not incorporated in the creation of packaging designs; Being disregarded or undervalued in the creation process, leading to less appealing designs; To be considered unnecessary or irrelevant in the field of graphic design; Not being utilized, leading to unsuccessful packaging systems; Not being recognized or utilized in the design process; Being disregarded or not effectively applied, resulting in unappealing packaging designs and decreased sales; Being disregarded or not applied in the design process; Being considered unnecessary or ineffective in the field of graphic design"
Cost-Burdened Renters,Population demographic factor,Affordable housing options and stable rent prices,"Economic hardship, eviction, and housing insecurity"
Consumer,Entity,"To make informed buying decisions; To have visually appealing and attractive packaging designs; To have access to well-designed and visually appealing packaging; To be informed, educated, and persuaded favorably towards targeted products through visually appealing package designs; To have visually appealing product packaging that attracts their attention and preference; To have packaging designs influenced by graphic design theories","Being misled by ineffective packaging design; Receiving unattractive or poorly designed packaging that may affect their consumption preferences; To receive poorly designed or unattractive packaging that does not meet their expectations; Being misled or confused by poorly designed package designs that do not follow graphic design theories, leading to potential misunderstanding or misinterpretation of information; Receiving unattractive or poorly designed packaging that does not meet their expectations; Receiving packaging that is not informed by graphic design theories and is less effective"
Population employed in service industry,Demographic group,Desires job stability and opportunities for career growth,Fears economic downturns and job insecurity
"Population employed in farming, fishing, and forestry occupations",Demographic group,"Desires sustainable livelihoods, access to resources","Fears environmental degradation, loss of income"
"Population employed in transportation, communications, and other public utilities",Demographic group,Desires efficient infrastructure and reliable services,Fears disruptions in essential services and transportation
Females in the labor force,Demographic group,Desires equal opportunities for work and career advancement,Fears gender discrimination and unequal pay
Population collecting social security benefits,Demographic group,Desires financial support and social welfare,Fears cuts to social security benefits and financial insecurity
Communities,Social Group,"Equitable planning for sea level rise and storm events, reduced sensitivity to hazards, opportunities for renewal, reorganization, and adaptation during difficult times; Strong community relationships, support in times of crisis; Inclusion, empowerment, and resilience; An open flow of information, communication, and dialogue in the adaptation planning process","Social inequity undermining their capacity to respond and rebuild from hazards, disproportionate impacts from disasters, lack of community resilience; Being cut off from important services and employment; Marginalization, vulnerability, and lack of resources; Lack of meaningful engagement in vulnerable communities and insufficient funding for climate change adaptation"
Urban population,Demographic group,Desires access to urban amenities and opportunities,"Fears overcrowding, pollution, and lack of resources"
Color,Design Element,To trigger viewers' emotions and deliver information effectively in design,Not being acknowledged for its importance in design; Not being utilized effectively or being overshadowed by other design elements
Product packages,Physical product,To possess strong visual impact and positively influence buying behavior,Being poorly designed and not attracting consumers
High social vulnerability population,Demographic group,"Desires support, resources, and resilience-building measures","Fears exposure to risks, marginalization, and lack of assistance"
Chilean Foreign Trade,Economic Activity,Sustained growth and enhanced competitiveness in international trade,"High logistics costs, congestion at port facilities, inefficient processes"
Packaging systems,Concept,To be visually appealing and effectively market products to consumers at the points of purchase; Effective application of Graphic Design-theories,"Not being able to utilize graphic design theories in packaging design, leading to less successful marketing and lower sales; Ineffective graphic design theories application leading to futile efforts"
Package Designs,Concept,"To effectively inform, educate, and persuade consumers towards purchasing the product they represent, following appropriate graphic design theories; To be appealing and effective in conveying information to consumers; To be perceived as effective and appealing to consumers","Being disregarded or misinterpreted by consumers due to poor design choices or lack of adherence to graphic design principles, resulting in decreased consumption rate or purchase preferences; Not being attractive or failing to fulfill its purpose; To be deemed unappealing or ineffective in conveying the intended message"
Collaborative Supply Chain Management System,Concept,"Stakeholders integration and collaboration, redesign process, new structures under a collaborative scheme; Efficient collaboration between stakeholders in the port logistics chain","Lack of coordination, gaps in logistics management practices, disruptions in the supply chain; Lack of collaborative planning leading to congestion and inefficiency"
Graphic Design Theories,Concept,To be perceived as essential for developing attractive packaging and designs; To provide a system of ideas that help designers explain their design choices; To be acknowledged as essential for creating attractive graphic/package designs; To be recognized as essential in packaging design and development of upcoming graphic designers; Being applied effectively in packaging technology; To positively influence the creation of effective and attractive package designs; To guide graphic designers in creating visually appealing packaging designs that enhance product marketing; To be positively influential in the creation of effective and attractive package designs; To be recognized as playing an important role in packaging design,"Being overlooked or not considered important in the creation of appealing graphic designs; Being disregarded or not incorporated in the creation of packaging designs; Being disregarded or undervalued in the creation process, leading to less appealing designs; To be considered unnecessary or irrelevant in the field of graphic design; Not being utilized, leading to unsuccessful packaging systems; Not being recognized or utilized in the design process; Being disregarded or not effectively applied, resulting in unappealing packaging designs and decreased sales; Being disregarded or not applied in the design process; Being considered unnecessary or ineffective in the field of graphic design"
Packaging Systems,Concept,To be visually appealing and effectively market products to consumers at the points of purchase; Effective application of Graphic Design-theories,"Not being able to utilize graphic design theories in packaging design, leading to less successful marketing and lower sales; Ineffective graphic design theories application leading to futile efforts"
Colour,Design Element,To trigger viewers' emotions and deliver information effectively in design,Not being utilized effectively or being overshadowed by other design elements; Not being acknowledged for its importance in design
Port Community,Organizational structure,"Facilitate dialogue, communication, and integration among public and private stakeholders in the port logistics chain; Coordinate and improve physical and information flows for continuous enhancement of operations","Lack of coordination, communication, and collaboration leading to inefficiencies, conflicts, disruptions in information flow, and trade process inefficiencies"
Port Logistics Operations Model,Concept,Well-defined relationship between port infrastructure and logistics processes for efficient operations; Efficient and streamlined port operations with minimal delays and costs; The coordination of common resources and the reduction of operational variability,"Lack of clarity or mismanagement in the relationship between port infrastructure and logistics processes leading to inefficiencies; Inefficient operations, high costs, and delays in port activities; Lack of coordination among stakeholders and high operational variability"
Technological solutions,Tools or systems,Supporting decision-making processes and optimizing operations,Failure or inadequacy of technology impacting supply chain efficiency
Operational level decisions,Decision-making process,Effective execution and control of plans for orders and vehicle flows,Ineffective execution leading to disruptions in the supply chain
Tactical decisions,Decision-making process,Accurate estimation of demand and efficient operations planning,Inaccurate estimations leading to operational inefficiencies
Seaport Clusters,Logistics infrastructure,Efficient coordination among public and private stakeholders to streamline transport operations and international trade logistics,"Inefficiencies, congestion, and long waiting times due to coordination problems and paper-based documentation processes"
Graphic designers,Professionals,"Continuous improvement in skills and professionalism, fostering future development in the design discipline; To create visually appealing packaging designs that attract consumers and effectively market products; To be used effectively as building blocks of design to create visually appealing and impactful designs","Ineffective use of knowledge or skill, outdated design theories hindering progress; Creating package designs that are unattractive or ineffective in influencing consumer behavior due to a lack of knowledge or disregard for graphic design theories; Being misplaced or misinterpreted, leading to misrepresentation or confusion in the design"
Port Community Systems,Concept,Facilitate trade and increase efficiency by reducing time and costs in port operations; Implementation of a single port window for efficient port operations,"Inefficiencies in trade facilitation and increased time and costs in port operations; Lack of coordination and integration among different systems operated by stakeholders, inefficiency in port operations"
Logistics Management Platform System,Concept,"Efficient planning, scheduling, and control of physical and information flows throughout the port logistics chain; Effective management of inter-enterprise processes through information technologies; Efficient and effective physical and documental flow in the PLC",Technological failures or disruptions that could disrupt the flow of logistics operations; Ineffective management of inter-enterprise processes leading to inefficiencies and delays; Inefficient processes and lack of coordination leading to delays and errors in logistics operations
Management of Port Logistics Governance,Governance structure,Well-balanced and integrated stakeholder approach for continuous improvement of inter-enterprise processes,"Lack of governance leading to chaos, inconsistency, and inability to address key logistics challenges"
Logistics Management Platform System (LMPS),Concept,"Effective management of inter-enterprise processes through information technologies; Efficient and effective physical and documental flow in the PLC; Efficient planning, scheduling, and control of physical and information flows throughout the port logistics chain",Ineffective management of inter-enterprise processes leading to inefficiencies and delays; Inefficient processes and lack of coordination leading to delays and errors in logistics operations; Technological failures or disruptions that could disrupt the flow of logistics operations
Single Electronic Coordination Document (SECD),Document,"Integration of data among various stakeholders, minimization of paper documents and double typing of data","Lack of standardization and coordination among stakeholders, inefficiency in data exchange"
Supply Chain Management (SCM),Concept/Approach,Full integration and collaboration between trading partners to improve competitiveness and performance; Efficient integration and coordination of stakeholders for material and information flows,"Lack of integration and collaboration leading to inefficiencies, coordination problems, and congestion in the logistics chain; Disruptions in flows, system-wide costs, and failure to meet service level requirements"
Order Management System (OMS),System,"Efficient organization and coordination of physical and information flows at the port system; Efficient dispatching of import container flows, integration of information, and traceability","Long waiting times for documentation requirements and procedures, lack of integrated information management; Lack of control over activities, information integration issues, and lack of traceability"
Port Terminals,Infrastructure,Efficient handling of cargo operations and movement within the port to support evolving supply chains; High utilization rates,"Becoming bottleneck points due to inefficiencies and lack of adaptation to market needs; Low demand, inefficiency, and disruptions in logistics flow"
Port Community System (PCS),Concept,Implementation of a single port window for efficient port operations; Facilitate trade and increase efficiency by reducing time and costs in port operations,"Lack of coordination and integration among different systems operated by stakeholders, inefficiency in port operations; Inefficiencies in trade facilitation and increased time and costs in port operations"
Port and Maritime Industry,Industry sector,To be oriented towards supply chains and achieve logistics integration to meet the changing needs of users and customers,"Difficulty in achieving integration in the supply chain due to data sharing issues, lack of cohesion, and trust among different stakeholders"
Inland Transport Firms,Companies,To collaborate with maritime shipping lines and establish long-term business relationships,Lack of access to hinterland and inability to improve attractiveness of ports to users
Respondents,Group,To provide accurate and valuable information based on their experiences and buying behaviors,Providing inaccurate information that may lead to incorrect conclusions in the study
traceability,concept,Complete and accurate traceability of trucks and cargo movements,Loss of traceability leading to security or operational risks
Terminal Managers,Stakeholder,Accurate demand forecasts and efficient resource planning,Inadequate information leading to delays and inefficiencies in cargo handling
traffic control,concept,Smooth and efficient traffic flow for trucks within the port,"Congestion, delays, or accidents due to lack of proper traffic control"
Customs and Customs Agents,Stakeholder,Effective anticipation of workloads and appropriate assignment of personnel for clearance processes,Uncertainty in workload forecasts and inadequate coordination with other stakeholders
Third Party Logistics Providers,Companies,To reconfigure a more competitive port network structure and establish long-term business relationships,"Lack of bargaining power over suppliers due to lack of coordination and sharing of logistics information, techniques, and resources"
Parking zones,Physical area,Efficient utilization of space and minimal waiting times for vehicles,"Congestion, long waiting times, and inefficiency in the parking system"
Truck drivers,External stakeholders,Quick turnaround times at the port terminals,"Congestion, delays, and inefficiency in cargo handling"
notifications,concept,Timely and accurate notifications regarding truck and cargo status,Missed or incorrect notifications leading to disruptions in operations
Truck,Vehicle,"Quick and efficient service at the terminal, reduced waiting times","Long service times, congestion at the port, delays in the logistics chain"
Maritime Port Logistics Chain (PLC),System,Increased productivity and efficiency through collaborative management of resources; Reduction of variability through better coordination among stakeholders,"Ineffective coordination among stakeholders and poor utilization of common resources; High logistics costs, congestion at port facilities, document errors and duplications"
Committees,Organizational structure,Efficient collaboration and decision-making within the port logistics operations,Lack of coordination and communication leading to inefficiencies in the logistics chain
Demand Management System (DMS),Forecasting tool,Efficient coordination among stakeholders in the maritime port logistics chain; Accurate prediction of workload content at different port areas; Efficient demand forecasting,"Lack of standardized information and poor task scheduling leading to inefficiencies in resource planning; Underestimation or overestimation of workload, leading to inefficiencies in resource allocation and scheduling"
Demand Management System,Forecasting tool,"Accurate prediction of workload content at different port areas, efficient demand forecasting, Efficient coordination among stakeholders in the maritime port logistics chain","Underestimation or overestimation of workload, leading to inefficiencies in resource allocation and scheduling, Lack of standardized information and poor task scheduling leading to inefficiencies in resource planning"
Cargo,Physical goods,Smooth and timely processing at the port terminals,"Damage, loss, or delays in handling and transportation"
External customers,Stakeholders,Efficient and timely processing of orders and smooth coordination of vehicle and cargo flows within the port,"Delays or disruptions in cargo flow and order processing, congestion, inefficiency, and delays in cargo handling"
Vehicles,Physical assets,Efficient coordination and utilization at the port,"Congestion, delays, and inefficiency in vehicle movements"
Port access,Infrastructure,Efficient flow of goods and reduced congestion,Increased congestion and pollution causing delays and inefficiencies
Internal customers,Stakeholders,Smooth coordination of vehicle and cargo flows within the port; Efficient and timely processing of orders at the port,"Congestion, inefficiency, and delays in cargo handling; Delays or disruptions in the cargo flow and order processing"
Truck Appointment System,System,"Anticipated arrival information from trucks, better resource utilization, increased service levels; Efficient scheduling and coordination of truck arrivals and departures; Improved vehicle and information flows at the port, reduced service times, and increased productivity for external trucks","Lack of coordination, poor planning, inefficiency in truck handling; Disorganized truck flow leading to congestion and delays; Delays in appointments, disruptions in information flow, and decreased productivity for external trucks"
Port Authority,Organization,"Smooth operations, efficient handling of trucks, reduced waiting times, smooth operations at the port terminals, efficient use of resources, timely handling of cargo, efficient traffic flow management within the port system, efficient logistics performance, identification of key factors impacting the system","Congestion, inefficiency in service, delays in the logistics chain, terminal congestion, delays in cargo operations, disruptions in the logistics chain, inefficiency, lack of stakeholder cooperation, disruptions in international trade logistics"
Vehicles Management System,Logistics technology,"Effective coordination and control of traffic within the port, efficient resource planning and scheduling, improved coordination with hinterland and road access, standardization in procedures, technological support, and efficient operations","Inadequate operational parameters, disruptions in traffic flow, and inefficiencies in resource utilization, lack of coordination, standardization, accountability, technological support, and inefficiencies leading to service quality and cost impacts"
Logistics Model,Operational framework,"Optimal integration of port terminals, efficient traffic management, reduced cargo dwell times","Terminal overcrowding, increased congestion in surrounding areas, storage space limitations"
Port Terminal,Infrastructure,"Efficient operations, high utilization rates, and efficient handling of cargo operations to support evolving supply chains","Low demand, inefficiency, disruptions in logistics flow, and becoming bottleneck points due to lack of adaptation to market needs"
Forecast Models,System,Accurate and updated forecasts for demand management,Inaccurate forecasts leading to inefficiencies in operations
"Inter-enterprise business processes (demand management, orders management, vehicles management)",Concept,"Effective planning, scheduling, control, and execution of collaborative processes","Inefficiency, lack of synchronization, and poor decision-making in inter-enterprise processes"
Stakeholders of the Port Logistics Chain (PLC),Group of Entities,Enhanced integration and collaboration among stakeholders,"Lack of coordination, limited communication, and disconnection between entities"
Empty Container Depots and Warehouses,Storage Facilities,Desire for a constant flow of goods for storage and distribution,"Fears of low occupancy rates, lack of demand, and inefficient storage practices"
Resource utilization and efficiency,Concept,"Optimal resource allocation, improved operational efficiency, alignment with collaborative framework","Inefficient resource usage, operational bottlenecks, lack of integration with proposed systems"
Ship Planning,Activity,"Arrival of ships during the week, accurate demand forecast for operations planning, efficient cargo planning and scheduling","Unplanned ship arrivals, inaccurate demand forecasts, inefficient cargo planning leading to operational disruptions"
