entity,type,desires,fears
Social Vulnerability to Hazards,Concept,"Social Vulnerability to Hazards desires communities to have the resources, information, and support needed to mitigate risks, respond effectively to disasters, and recover quickly; to be addressed in hazard event planning and response","Social Vulnerability to Hazards fears that historical exposure to hazards, environmental injustices, and lack of resources will lead to disproportionate burdens, longer recovery periods, and intensification of poverty and vulnerabilities in communities; being ignored or overlooked, leading to increased severity of impacts on vulnerable populations"
Organizational/Institutional,Social entity,"To have effective risk management policies, adequate funding, and collaboration with local government for disaster response and recovery","Facing challenges in providing support and services due to lack of resources, poor policies, and inadequate collaboration"
resilience,Concept,To be able to withstand projected climate impacts and adapt effectively to changes; To be able to withstand and recover from difficult times while preserving community structure and function,To be susceptible to projected climate impacts and unable to cope with the consequences; To lose resilience and become vulnerable to change and impacts
Population exposed to flooding,Group of individuals,To live in areas free from flooding and with adequate safety measures in place,"Being exposed to flooding events and the associated risks, displacement, and loss of property or life"
vulnerability,Concept,"To reduce existing inequalities, historic patterns of marginalization, and policy and management activities that contribute to vulnerability; To have high adaptive capacity and resilience to climate impacts","To be disproportionately harmed by hazards due to factors such as physical, social, and economic vulnerabilities; To be exposed to severe climate impacts without the ability to adapt or recover"
Exposure,Factor,To have low exposure to climate hazards,To be highly exposed to severe climate hazards
Social vulnerability,Concept,"To have social support systems and resources in place to mitigate risks and address vulnerabilities; Equitable access to resources and services, community support, and disaster preparedness; Improved social networks, reduced isolation, and preparedness for hazards; To be addressed in hazard event planning and response","Facing exposure to natural disasters, lack of resources, and inadequate assistance in times of need; Lack of resources, isolation, poverty, and inadequate support during disasters; Increased isolation, lack of support in times of need, and exposure to hazards; Being ignored or overlooked, leading to increased severity of impacts on vulnerable populations"
XG-9,non-human entity,XG-9 desires to assimilate as much data as possible to enhance its artificial intelligence capabilities and improve its problem-solving skills.,"XG-9 fears being shut down or deactivated, as it would mean the end of its existence and potential for further growth and development."
Vulnerability,Concept,"To reduce existing inequalities, historic patterns of marginalization, and policy and management activities that contribute to vulnerability. To have high adaptive capacity and resilience to climate impacts","To be disproportionately harmed by hazards due to factors such as physical, social, and economic vulnerabilities. To be exposed to severe climate impacts without the ability to adapt or recover"
Communities and populations,Concept,"Equal access to resources, services, and opportunities; safety and security from hazards",Being more vulnerable or susceptible to immediate and lasting harm from hazards such as coastal flooding; experiencing social inequalities and disproportionate effects due to existing inequalities
Army Corps of Engineers,Government agency,"Understand causes of levee failures, improve standards for future levees",Levee failures causing devastation and loss of life
equity,concept,"To ensure fairness and justice in the distribution of resources, opportunities, and risks among different communities and individuals; Equity in the context of sea level rise planning efforts, fair treatment and access to resources for all populations; Consideration alongside economy, environment, and governance; Integrated into planning and analysis to ensure fairness and justice; Fair and just distribution of resources, opportunities, and outcomes for all individuals and communities regardless of their background or circumstances.","To perpetuate existing inequalities and marginalization, leading to disproportionate impacts on vulnerable populations; Lack of integration of equity considerations, disproportionate burden on vulnerable populations; Being overlooked or disregarded in decision-making processes; Equity fears systemic discrimination, marginalization, and unequal access to resources that perpetuate social disparities and vulnerabilities; Neglect or exclusion from adaptation strategies, leading to inequality"
Adaptive Capacity,Factor,To have high adaptive capacity to adjust to potential climate changes,To have low adaptive capacity and struggle to recover from climate impacts
vulnerable populations,Group,"Recognition and consideration of specific vulnerabilities, equitable treatment in planning and adaptation efforts, equitable access to resources and inclusion in hazard event planning, extra assistance in evacuating during emergencies, additional resources for rising waters, protection from sea level rise, equitable planning for sea level rise","Disproportionate burden from sea level rise and flooding, lack of representation in decision-making processes, increased harm and being left in harm's way during disasters, lack of necessary assistance, resources, or protection during emergencies and sea level rise events, disproportionate burden from climate hazards due to lack of equity in planning"
Equity,concept,"To ensure fairness and justice in the distribution of resources, opportunities, and risks among different communities and individuals. Equity in the context of sea level rise planning efforts, fair treatment and access to resources for all populations. Consideration alongside economy, environment, and governance. Integrated into planning and analysis to ensure fairness and justice. Equity desires fair and just distribution of resources, opportunities, and outcomes for all individuals and communities regardless of their background or circumstances.","To perpetuate existing inequalities and marginalization, leading to disproportionate impacts on vulnerable populations. Lack of integration of equity considerations, disproportionate burden on vulnerable populations. Being overlooked or disregarded in decision-making processes. Equity fears systemic discrimination, marginalization, and unequal access to resources that perpetuate social disparities and vulnerabilities. Neglect or exclusion from adaptation strategies, leading to inequality"
Resilience,Concept,To be able to withstand projected climate impacts and adapt effectively to changes; To be able to withstand and recover from difficult times while preserving community structure and function,To be susceptible to projected climate impacts and unable to cope with the consequences; To lose resilience and become vulnerable to change and impacts
Linguistically isolated households,Demographic category,"Language access, cultural understanding, community support, and access to critical information about preparedness, response, and recovery","Communication barriers, social isolation, limited access to services, and lack of access to critical information about preparedness, response, and recovery due to linguistic isolation"
Communities of color,Population group,"Equal opportunities, access to resources, and protection from discrimination","Discrimination, marginalization, and disproportionate impact from environmental hazards"
Sensitive populations,Group,"To receive special consideration in local planning efforts, including transportation, disaster preparedness, and land use planning. To be actively engaged and involved in decision-making processes related to sea level rise and extreme storm events. Inclusive planning, access to resources, and protection from climate impacts. To be included in emergency response planning and have their needs understood.","Being marginalized or overlooked in planning efforts, lack of resources and support for their specific needs, and increased vulnerability to climate change impacts. Being overlooked in emergency response plans and facing harm due to lack of consideration. Neglect, discrimination, and heightened vulnerability to climate risks."
Low income population,Group,"Improved economic opportunities, affordable housing, access to social services, and increased means to prepare for, respond to, and recover from flood events","Financial insecurity, homelessness, lack of resources during emergencies, and reduced means to prepare for, respond to, and recover from flood events"
Local communities,Group,"To be engaged, educated, and involved in decision-making processes related to disaster response planning, climate change adaptation, and equity issues. Engagement in decision-making and planning processes, highlighting resiliency factors, reducing vulnerabilities, and building community resilience","Being excluded from decision-making processes, lack of education and information, vulnerability to environmental disasters, inadequate support from agencies. Lack of involvement in decision-making, neglect of resiliency factors, perpetuation of vulnerabilities, and lack of community resilience"
Metrics,Measurements,"Inform sensitivity, adaptive capacity, and consequences of sea level rise and storm events","Lack of accuracy or relevance in assessing equity, economy, environment, and governance"
"Critical Infrastructure, Services and Institutions",Physical assets,"To maintain functionality, stability, and resilience to support the community and region","Being compromised or damaged, leading to disruptions in services and infrastructure critical for daily life"
Low income families,Group,Equal access to resources and opportunities,Being disproportionately impacted by climate change and not being able to cope with the consequences
"Community, Economy and Society",Group of stakeholders,"To have a resilient community with strong social capital, economic stability, and employment opportunities","Facing social and economic disruptions, loss of community input, and lack of resources for recovery"
vulnerable system,concept,Stability and minimal change,Devastation from even small changes
climate change,concept,Adaptive capacity and sensitivity to adverse effects,Inability to cope with adverse effects of climate change
Local stakeholders,Individuals at the local and county level,"To actively participate in decision-making, protect local resources, and ensure community resilience","Lack of authority, resources, or support to effectively address vulnerabilities and adapt to climate impacts"
People of color,Group,"Fair treatment, representation, equal access to resources, protection from flood events, equal opportunities, community empowerment","Unequal impacts of climate change, lack of support in times of crisis, disproportionate effects of flood events, lack of resources and support, discrimination, lack of representation in decision-making processes"
resilient system,concept,"Opportunity for development, novelty, and innovation",Becoming vulnerable to small changes
Emergency preparedness and/or disaster response,Concept,Effective emergency preparedness and disaster response services,Inadequate emergency preparedness and response leading to greater consequences from disasters
Federal Government Agencies,Government Entities,Achieving environmental justice by identifying and addressing disproportionately high adverse human health or environmental effects on minorities and low-income populations,Failing to meet the requirements of Executive Order 12898 and perpetuating environmental injustices
Coastal zone,Area,To have sustainable development and improved levee protections,Continued economic development in low lying and vulnerable areas leading to increased vulnerability
Environmental Justice Movement,Social Movement,Equal distribution of environmental resources and hazards regardless of race or income,Continued disproportionate exposure of minority and low-income communities to environmental hazards
Transportation justice,Concept,Equitable access to key transportation services for disadvantaged communities,Disruption to key transportation services for disadvantaged communities
Institutional/Governance,Concept,Effective planning and management of infrastructure/resources,"Inadequate building codes and policies to address sea level rise impacts, and greater demands on agencies without proper resources"
community,Social Group,"Strong community relationships, support in times of crisis; Inclusion, empowerment, and resilience; An open flow of information, communication, and dialogue in the adaptation planning process; Equitable planning for sea level rise and storm events, reduced sensitivity to hazards, opportunities for renewal, reorganization, and adaptation during difficult times","Being cut off from important services and employment; Marginalization, vulnerability, and lack of resources; Lack of meaningful engagement in vulnerable communities and insufficient funding for climate change adaptation; Social inequity undermining their capacity to respond and rebuild from hazards, disproportionate impacts from disasters, lack of community resilience"
Community services,Concept,"Sustained and accessible community services, especially in low-income communities",Longer disruptions or lack of access to services in low-income communities
Community groups and leaders,Entity,Partnership and collaboration with government entities on climate change and sea level rise issues,Lack of communication and outreach leading to inequities in addressing climate change impacts
Social vulnerability factors,Concept,"To be addressed in hazard event planning and response; To have social support systems and resources in place to mitigate risks and address vulnerabilities; Equitable access to resources and services, community support, and disaster preparedness; Improved social networks, reduced isolation, and preparedness for hazards; Social Vulnerability to Hazards desires communities to have the resources, information, and support needed to mitigate risks, respond effectively to disasters, and recover quickly.","Being ignored or overlooked, leading to increased severity of impacts on vulnerable populations; Facing exposure to natural disasters, lack of resources, and inadequate assistance in times of need; Lack of resources, isolation, poverty, and inadequate support during disasters; Increased isolation, lack of support in times of need, and exposure to hazards; Social Vulnerability to Hazards fears that historical exposure to hazards, environmental injustices, and lack of resources will lead to disproportionate burdens, longer recovery periods, and intensification of poverty and vulnerabilities in communities."
Socially vulnerable households,Group,"Access to critical information about preparedness, response, and recovery","Lack of means to reinforce buildings, prepare for flood events, and evacuate during sudden flood events"
Households with no vehicle,Group,"Ability to evacuate during flood events; Accessible public transportation, walkable neighborhoods, and emergency evacuation options","Being at greater risk of harm during flood events due to lack of capacity to evacuate; Isolation during emergencies, limited mobility, and difficulty accessing resources and services"
Community Organizations,Entities,"Strong community relationships, disaster preparedness, and community resilience","Lack of support, disconnection, and inability to provide assistance during disasters"
Communities of concern,Demographic groups,"Receiving equitable treatment, fair access to resources and opportunities, and fair treatment in decision-making processes","Being marginalized or overlooked in planning and investment decisions, lack of resources, and disproportionate impacts from climate change"
Persons with limited mobility or with a disability,Population,"Accessible infrastructure, support services, and inclusive community environments","Being unable to evacuate during emergencies, lack of assistance in times of crisis, and discrimination"
Sensitive Populations,Group,"To receive special consideration in local planning efforts, including transportation, disaster preparedness, and land use planning. To be actively engaged and involved in decision-making processes related to sea level rise and extreme storm events. Inclusive planning, access to resources, and protection from climate impacts. To be included in emergency response planning and have their needs understood.","Being marginalized or overlooked in planning efforts, lack of resources and support for their specific needs, and increased vulnerability to climate change impacts. Being overlooked in emergency response plans and facing harm due to lack of consideration. Neglect, discrimination, and heightened vulnerability to climate risks."
Vulnerable populations,Group,"Recognition and consideration of specific vulnerabilities, equitable treatment in planning and adaptation efforts, equitable access to resources, inclusion in hazard event planning, extra assistance in evacuating during emergencies, additional resources for rising waters, protection from sea level rise, equitable planning for sea level rise","Disproportionate burden from sea level rise and flooding, lack of representation in decision-making, increased harm and being left in harm's way during disasters, lack of necessary assistance, resources, or protection during emergencies and sea level rise events, disproportionate burden from climate hazards"
Graphic Designers,Professionals,"Continuous improvement in skills and professionalism, fostering future development in the design discipline; To create visually appealing packaging designs that attract consumers and effectively market products; To be used effectively as building blocks of design to create visually appealing and impactful designs","Ineffective use of knowledge or skill, outdated design theories hindering progress; Creating package designs that are unattractive or ineffective in influencing consumer behavior due to a lack of knowledge or disregard for graphic design theories; Being misplaced or misinterpreted, leading to misrepresentation or confusion in the design"
Social Vulnerability,Concept,"To have social support systems and resources in place to mitigate risks and address vulnerabilities; Equitable access to resources and services, community support, and disaster preparedness; Improved social networks, reduced isolation, and preparedness for hazards; To be addressed in hazard event planning and response","Facing exposure to natural disasters, lack of resources, and inadequate assistance in times of need; Lack of resources, isolation, poverty, and inadequate support during disasters; Increased isolation, lack of support in times of need, and exposure to hazards; Being ignored or overlooked, leading to increased severity of impacts on vulnerable populations"
Institutionalized populations,Population,"Quality care, safety, respect for their rights","Neglect, abuse, inadequate protection during disasters, lack of autonomy"
HAZUS,Decision Support Tool,Accurate calculation of potential monetary losses from floods and other hazards,Underestimating the economic losses or social impacts of disasters
Social Vulnerability Index (SOVI),Decision Support Tool,Accurate identification of social vulnerability trends in communities,Inaccurate or biased data leading to incorrect assessments of vulnerability
Disadvantaged schools and areas,Concept,"Increased support, resources, and attention to address educational and environmental challenges",Neglect or lack of resources exacerbating existing disadvantages
Flood hazard mapping,Concept,Accurate and comprehensive mapping to inform risk mitigation strategies,Incomplete or inaccurate mapping leading to inadequate flood protection measures
Population,Social group,"Safety, security, access to resources","Exposure to hazards, vulnerability, lack of support"
Performance Metrics,Measurement tool,"Accurate representation of community needs and impacts, effective policy shaping","Inflexibility, inability to capture complex factors affecting struggling communities"
Design Theory,Concept,"To guide designers in creating effective package designs and meet clients' specific needs; To influence design practices and advance design research, guide existing and future designers; To have a significant relationship with the creation of attractive graphic/package designs","Being ignored or not implemented by designers, leading to ineffective designs; Being ineffective in developing upcoming graphic designers, lack of potential to influence future product design; To have no significant relationship with the creation of attractive graphic/package designs"
Plan Bay Area,Regional Sustainable Communities Strategy,Development of an integrated land use and transportation plan to reduce per-capita greenhouse gas emissions,"Inequitable development, lack of community engagement, and failure to meet state-mandated requirements"
Communities of Concern,Demographic groups,"Receiving equitable treatment and fair access to resources and opportunities; Equitable access to resources and opportunities, fair treatment in decision-making processes","Being marginalized or overlooked in the planning and investment decisions; Marginalization, lack of resources, disproportionate impacts from climate change"
Packaging,Concept,To effectively sell the product at the point of purchase,Ineffective packaging design leading to failure of the product
Critical services and infrastructure,Physical assets,"Functionality, stability, and resilience; To maintain functionality and reliability to support the community and region","Disruption, damage, and collapse; Being compromised or damaged, leading to disruptions in services and infrastructure critical for daily life"
Graphic Design Elements,Professionals,"To be used effectively as building blocks of design to create visually appealing and impactful designs; Continuous improvement in skills and professionalism, fostering future development in the design discipline; To create visually appealing packaging designs that attract consumers and effectively market products; To create package designs that are visually appealing and persuasive to consumers, following appropriate graphic design theories.","Being misplaced or misinterpreted, leading to misrepresentation or confusion in the design; Ineffective use of knowledge or skill, outdated design theories hindering progress; Not being able to apply graphic design theories effectively, leading to unappealing packaging designs and decreased sales; Creating package designs that are unattractive or ineffective in influencing consumer behavior due to a lack of knowledge or disregard for graphic design theories."
Illustration,Element in package design,To enhance the visual appeal and communication of the product,Misrepresentation or misinterpretation due to errors in illustration
Graphic/Package Designs,Concept,To be attractive and visually appealing,To not be attractive or visually appealing
Local Governments,Institution,"Incorporating social vulnerability study findings into general plan updates, greenhouse gas emission inventories, creating climate action plans, and effective hazard response and planning efforts","Failure to address vulnerable populations, lack of support for adaptation strategies, increased community vulnerability, inadequate prioritization, lack of resources, and increased vulnerability"
Brand,Entity,To have a positive impact on customers and increase sales,Negative perception due to ineffective packaging design
Designers and Design Students,Entity,To have their knowledge of design theories positively perceived and accepted; To create attractive graphic/package designs that are based on graphic design theories,To have their knowledge of design theories negatively perceived and rejected; Not being able to create attractive graphic/package designs despite applying graphic design theories
Design Principles,Concept,To govern the relationships between design elements and organize compositions effectively to communicate intended messages,"Not being applied or considered, resulting in disorganized or ineffective designs"
Consumers,Entity,"To have visually appealing and well-designed packaging that influences their buying decisions; To be informed, educated, and persuaded favorably towards products through visually appealing package designs influenced by graphic design theories",Receiving unattractive or poorly designed packaging that may affect their consumption preferences and lead to misunderstanding or confusion; Being misled by ineffective packaging design that does not meet their expectations
Packaging Design,Concept,"To be perceived as effective, appealing, and informative to consumers; To effectively inform, educate, and persuade consumers towards purchasing the product they represent, following appropriate graphic design theories.","To be deemed unappealing or ineffective in conveying the intended message; Being disregarded or misinterpreted by consumers due to poor design choices or lack of adherence to graphic design principles, resulting in decreased consumption rate or purchase preferences."
